{
  "generated_at": "2026-07-07",
  "summary": {
    "existing_count": 43,
    "draft_count": 107,
    "matched_existing": 14,
    "new_candidate": 87,
    "needs_manual_review": 15,
    "field_updates_available": 5
  },
  "matched_existing": [
    {
      "existing": {
        "id": "jeju_rest_sinsan_015",
        "name": "신산공원",
        "region": "제주시",
        "category": "rest_area",
        "verification_status": "partial"
      },
      "draft": {
        "id": "jeju_roadview_place_002",
        "name": "신산공원",
        "region": "제주시",
        "category": "rest_area",
        "verification_status": "partial"
      },
      "match_confidence": 1.0,
      "match_reasons": [
        "name_exact",
        "region_overlap",
        "category_match"
      ],
      "field_updates": [
        {
          "field": "parking",
          "existing_state": "partial",
          "existing_note": "제주영상문화산업진흥원과 문예회관 주차장 이용 가능 정보 있음",
          "draft_state": "yes",
          "draft_note": "장애인 주차장 보유 수: 1개",
          "draft_source_ref": "jeju_roadview_facility_status",
          "recommended_action": "review_and_update_existing_card"
        },
        {
          "field": "rental_or_assistance",
          "existing_state": "unknown",
          "existing_note": "대여 정보 확인 필요",
          "draft_state": "no",
          "draft_note": "휠체어 대여 가능 여부: N",
          "draft_source_ref": "jeju_roadview_facility_status",
          "recommended_action": "review_and_update_existing_card"
        }
      ],
      "field_conflicts": [
        {
          "field": "rest_area",
          "existing_state": "yes",
          "existing_note": "도심 공원 산책과 휴식 가능",
          "draft_state": "no",
          "draft_note": "휴게실 보유 여부: N",
          "draft_source_ref": "jeju_roadview_facility_status",
          "recommended_action": "review_and_update_existing_card"
        }
      ]
    },
    {
      "existing": {
        "id": "jeju_forest_halla_005",
        "name": "한라수목원",
        "region": "제주시",
        "category": "forest",
        "verification_status": "verified"
      },
      "draft": {
        "id": "jeju_roadview_place_009",
        "name": "한라수목원",
        "region": "제주시",
        "category": "forest",
        "verification_status": "partial"
      },
      "match_confidence": 1.0,
      "match_reasons": [
        "name_exact",
        "region_overlap",
        "category_match"
      ],
      "field_updates": [
        {
          "field": "rest_area",
          "existing_state": "partial",
          "existing_note": "수목원 내 휴식 가능성은 있으나 접근 가능한 위치 확인 필요",
          "draft_state": "no",
          "draft_note": "휴게실 보유 여부: N",
          "draft_source_ref": "jeju_roadview_facility_status",
          "recommended_action": "review_and_update_existing_card"
        }
      ],
      "field_conflicts": [
        {
          "field": "rental_or_assistance",
          "existing_state": "yes",
          "existing_note": "휠체어와 유아차 대여 정보 있음",
          "draft_state": "no",
          "draft_note": "휠체어 대여 가능 여부: N",
          "draft_source_ref": "jeju_roadview_facility_status",
          "recommended_action": "review_and_update_existing_card"
        }
      ]
    },
    {
      "existing": {
        "id": "jeju_culture_mokgwana_008",
        "name": "제주목관아",
        "region": "제주시",
        "category": "culture",
        "verification_status": "partial"
      },
      "draft": {
        "id": "jeju_roadview_place_012",
        "name": "제주목관아",
        "region": "제주시",
        "category": "other",
        "verification_status": "partial"
      },
      "match_confidence": 0.98,
      "match_reasons": [
        "name_exact",
        "region_overlap"
      ],
      "field_updates": [
        {
          "field": "parking",
          "existing_state": "partial",
          "existing_note": "기존 주차장 폐쇄 관련으로 서쪽 공영주차장 이용 필요",
          "draft_state": "yes",
          "draft_note": "장애인 주차장 보유 수: 1개",
          "draft_source_ref": "jeju_roadview_facility_status",
          "recommended_action": "review_and_update_existing_card"
        },
        {
          "field": "rest_area",
          "existing_state": "unknown",
          "existing_note": "접근 가능한 휴식 지점 확인 필요",
          "draft_state": "no",
          "draft_note": "휴게실 보유 여부: N",
          "draft_source_ref": "jeju_roadview_facility_status",
          "recommended_action": "review_and_update_existing_card"
        }
      ],
      "field_conflicts": []
    },
    {
      "existing": {
        "id": "jeju_forest_cheonjiyeon_014",
        "name": "천지연폭포",
        "region": "서귀포시",
        "category": "forest",
        "verification_status": "partial"
      },
      "draft": {
        "id": "jeju_roadview_place_035",
        "name": "천지연폭포",
        "region": "서귀포시",
        "category": "sea",
        "verification_status": "partial"
      },
      "match_confidence": 0.98,
      "match_reasons": [
        "name_exact",
        "region_overlap"
      ],
      "field_updates": [
        {
          "field": "accessible_toilet",
          "existing_state": "partial",
          "existing_note": "주차장 쪽과 매표소 부근 장애인 화장실에 각각 경사로 정보 있음",
          "draft_state": "yes",
          "draft_note": "장애인 화장실 보유 수: 2개",
          "draft_source_ref": "jeju_roadview_facility_status",
          "recommended_action": "review_and_update_existing_card"
        },
        {
          "field": "rest_area",
          "existing_state": "partial",
          "existing_note": "관람로 휴식 가능 위치 확인 필요",
          "draft_state": "no",
          "draft_note": "휴게실 보유 여부: N",
          "draft_source_ref": "jeju_roadview_facility_status",
          "recommended_action": "review_and_update_existing_card"
        }
      ],
      "field_conflicts": [
        {
          "field": "rental_or_assistance",
          "existing_state": "yes",
          "existing_note": "휠체어, 유아차 대여 가능",
          "draft_state": "no",
          "draft_note": "휠체어 대여 가능 여부: N",
          "draft_source_ref": "jeju_roadview_facility_status",
          "recommended_action": "review_and_update_existing_card"
        }
      ]
    },
    {
      "existing": {
        "id": "jeju_indoor_mandeok_museum_009",
        "name": "김만덕기념관",
        "region": "제주시",
        "category": "indoor",
        "verification_status": "partial"
      },
      "draft": {
        "id": "jeju_roadview_place_044",
        "name": "김만덕기념관",
        "region": "제주시",
        "category": "indoor",
        "verification_status": "partial"
      },
      "match_confidence": 1.0,
      "match_reasons": [
        "name_exact",
        "region_overlap",
        "category_match"
      ],
      "field_updates": [
        {
          "field": "parking",
          "existing_state": "partial",
          "existing_note": "건물 옆 장애인 주차장 1대, 출입구 접근로가 차도",
          "draft_state": "yes",
          "draft_note": "장애인 주차장 보유 수: 1개",
          "draft_source_ref": "jeju_roadview_facility_status",
          "recommended_action": "review_and_update_existing_card"
        },
        {
          "field": "rest_area",
          "existing_state": "partial",
          "existing_note": "실내 로비 휴식 가능성은 있으나 좌석 위치 확인 필요",
          "draft_state": "no",
          "draft_note": "휴게실 보유 여부: N",
          "draft_source_ref": "jeju_roadview_facility_status",
          "recommended_action": "review_and_update_existing_card"
        }
      ],
      "field_conflicts": [
        {
          "field": "rental_or_assistance",
          "existing_state": "yes",
          "existing_note": "휠체어 및 유아차 대여 가능",
          "draft_state": "no",
          "draft_note": "휠체어 대여 가능 여부: N",
          "draft_source_ref": "jeju_roadview_facility_status",
          "recommended_action": "review_and_update_existing_card"
        }
      ]
    },
    {
      "existing": {
        "id": "jeju_indoor_worldheritage_011",
        "name": "제주세계자연유산센터",
        "region": "제주시",
        "category": "indoor",
        "verification_status": "partial"
      },
      "draft": {
        "id": "jeju_roadview_place_045",
        "name": "제주세계자연유산센터",
        "region": "제주시",
        "category": "other",
        "verification_status": "partial"
      },
      "match_confidence": 0.98,
      "match_reasons": [
        "name_exact",
        "region_overlap"
      ],
      "field_updates": [
        {
          "field": "rest_area",
          "existing_state": "partial",
          "existing_note": "실내 관람 중 휴식 위치 확인 필요",
          "draft_state": "no",
          "draft_note": "휴게실 보유 여부: N",
          "draft_source_ref": "jeju_roadview_facility_status",
          "recommended_action": "review_and_update_existing_card"
        }
      ],
      "field_conflicts": []
    },
    {
      "existing": {
        "id": "jeju_forest_healing_001",
        "name": "서귀포 치유의숲",
        "region": "서귀포시",
        "category": "forest",
        "verification_status": "partial"
      },
      "draft": {
        "id": "jeju_roadview_place_049",
        "name": "서귀포치유의숲",
        "region": "서귀포시",
        "category": "forest",
        "verification_status": "partial"
      },
      "match_confidence": 1.0,
      "match_reasons": [
        "name_exact",
        "region_overlap",
        "category_match"
      ],
      "field_updates": [],
      "field_conflicts": [
        {
          "field": "rest_area",
          "existing_state": "yes",
          "existing_note": "숲길과 쉼팡 등 휴식 가능 구간이 있으나 이용 가능 구간 확인 필요",
          "draft_state": "no",
          "draft_note": "휴게실 보유 여부: N",
          "draft_source_ref": "jeju_roadview_facility_status",
          "recommended_action": "review_and_update_existing_card"
        },
        {
          "field": "rental_or_assistance",
          "existing_state": "yes",
          "existing_note": "휠체어와 유아차 대여 가능 정보 있음",
          "draft_state": "no",
          "draft_note": "휠체어 대여 가능 여부: N",
          "draft_source_ref": "jeju_roadview_facility_status",
          "recommended_action": "review_and_update_existing_card"
        }
      ]
    },
    {
      "existing": {